{
  "schema_version": "creative-provider-request-v1",
  "request_id": "d4-lencois-p3-atins-kite.es.instagram-carousel-p3.v1",
  "design_ref": "design:d4-lencois-p3-atins-kite:v1",
  "design_hash": "sha256:f13ec3bb001694c2878a0b18b9ccbf0b8bc2491c3820f15b5babd5017d868335",
  "reference_manifest_hash": "sha256:46607e86b0a98b549732e0b439b1e67cedb6e350fd89b6fd00fbabf4d4cfc40a",
  "locale": "es",
  "provider_profile": "codex-images",
  "capability": "generate_image",
  "budget": {
    "currency": "USD",
    "run_ceiling": 10,
    "authority_ref": "budget-envelope:verano-continua-2026:v1"
  },
  "prompt": "OBJECTIVE: Presentar Atins como base menos obvia (pesca y kitesurf) mientras los circuitos clasicos se llenan.\nAUDIENCE: Viajeros hispanohablantes que arman su ruta por los Lencois Maranhenses en Brasil y quieren vivirlos con calma y a buena hora.\nPROPOSITION: Atins, la base menos obvia: pesca y kitesurf.\nCONCEPT: Playa ventosa en la desembocadura del Preguicas con cometas de kite diminutas al fondo y una pareja caminando de espaldas a media distancia.\nSTORY: Segunda parada del hilo; contrasta con la postal clasica.\nSUBJECT: Una playa ancha y ventosa en la desembocadura del rio Preguicas junto a Atins; cometas de kitesurf diminutas y distantes sobre el agua; una pareja de viajeros camina a media/larga distancia de espaldas por la arena, sin rostros; un par de barcas de pesca sin nombre varadas muy al fondo.\nSCENE: Tarde ventosa y luminosa de temporada seca; gran angular con camara a ras de arena; ondas de viento en la arena como lineas guia hacia un horizonte bajo; leve sensacion de arena/spray en el aire; sin golden.\nCOMPOSITION: Plano vertical; playa, pareja distante, kites diminutos, barcas lejanas y horizonte en la banda media; banda inferior ~40% de arena lisa peinada por el viento como espacio negativo para la caja de texto y el conector al pie.\nPALETTE: arena palida, agua azul-gris del Atlantico y el rio, cometas de colores pequenas, cielo claro o levemente brumoso\nSTYLE: Fotografia editorial documental de estilo fotoperiodistico, color real y fiel con balance de blanco neutro, grano de pelicula muy sutil, aspecto autentico sin retoque; nada estilizado.\nLIGHTING: Luz fresca natural de tarde ventosa; colores reales; sin golden, sin teal-and-orange, sin HDR.\nCONTINUITY: Agua en azul-gris real, nunca turquesa tropical; Gente solo distante y de espaldas sin rostro; sin retratar pescadores; Coherencia editorial con bg-p1/bg-p2\nLOCALE: es / market GLOBAL; adaptation mode native. Pescadores y residentes NO se retratan; una pareja distante de espaldas; anti-masa honesta.\nPLACEMENT: instagram feed, 1080x1350; preserve safe zones from platform-spec:instagram-feed:2026-07-17.\nDISTINCTIVE ELEMENTS: Playa ventosa con ondas de viento en la arena; Cometas de kite diminutas y distantes; Pareja caminando de espaldas a media distancia\nREFERENCE INSTRUCTIONS: No provider-visible references.\nDETERMINISTIC POST-COMPOSITION: logo, overlay_text, cta. Leave intentional negative space for those layers.",
  "negative_constraints": [
    "Agua turquesa tropical o caribena; el agua es de lluvia en color real oliva-verdosa/azul-gris",
    "Bano dorado uniforme, golden hour wash, teal-and-orange, HDR",
    "Rostros identificables; multitudes; retratos de residentes o pescadores",
    "Cliches: otro planeta, Marte, paraiso magico, desierto que se inunda por magia",
    "Texto, logos o marcas dentro del pixel generado",
    "Barcas con nombre visible o matriculas",
    "Retratos de pescadores o residentes de Atins",
    "Do not render final logos, legal lines, prices, captions, CTA text or exact overlay copy inside the generated pixels.",
    "Do not imitate a living artist, competitor campaign or third-party brand style.",
    "Do not introduce products, people, claims or trademarks that are absent from the approved design and references."
  ],
  "parameters": {
    "placement_id": "instagram-carousel-p3",
    "width": 1080,
    "height": 1350,
    "quality_ref": "config:creative.image.quality",
    "output_format": "png",
    "max_attempts": 3,
    "max_assets": 1
  },
  "references": [],
  "request_hash": "sha256:51145537e6dece144c86dcb6bc59f9029a94b0c87ea5834109fc02710b806abb"
}
