{
  "schema_version": "creative-provider-request-v1",
  "request_id": "d4-lencois-p4-faro-mandacaru.es.instagram-carousel-p4.v1",
  "design_ref": "design:d4-lencois-p4-faro-mandacaru:v1",
  "design_hash": "sha256:dd6046458078647de0aa307158a001ec70038f8bcceb4bc5f70c0cc13241cde2",
  "reference_manifest_hash": "sha256:c70e193690793cf12cd041764fa5178e0d38f94a6dc835b8dcec124ae5ad041d",
  "locale": "es",
  "provider_profile": "codex-images",
  "capability": "generate_image",
  "budget": {
    "currency": "USD",
    "run_ceiling": 10,
    "authority_ref": "budget-envelope:verano-continua-2026:v1"
  },
  "prompt": "OBJECTIVE: Mostrar la otra cara del agua: la ruta del rio con el faro de Mandacaru.\nAUDIENCE: Viajeros hispanohablantes que arman su ruta por los Lencois Maranhenses en Brasil y quieren vivirlos con calma y a buena hora.\nPROPOSITION: El rio Preguicas: Mandacaru y Cabure.\nCONCEPT: El faro de Mandacaru alzandose sobre palmeras y manglares, sin personas, como parada fluvial del hilo.\nSTORY: Tercera parada del hilo; cambia dunas por rio/arquitectura.\nSUBJECT: El faro de Mandacaru, una torre esbelta de piedra palida y blanca, se alza sobre un grupo de palmeras verdes y manglares bajos junto al rio Preguicas; dunas blancas y el Atlantico azul al fondo; sin personas.\nSCENE: Mediodia claro de temporada seca; detalle arquitectonico vertical con camara baja en contrapicado mirando la torre; cielo azul con nubes dispersas; colores reales.\nCOMPOSITION: Plano vertical; el faro y las palmeras en el eje vertical central con la punta de la torre en la parte superior-media (sin tocar el borde); dunas y mar detras; banda inferior de palmeras/suelo en tono uniforme y cielo despejado a un lado de la torre como espacio negativo para la caja de texto y el conector.\nPALETTE: piedra palida y blanca del faro, verde de palmeras, dunas blancas, Atlantico azul, cielo azul con nubes\nSTYLE: Fotografia editorial documental de estilo fotoperiodistico, color real y fiel con balance de blanco neutro, grano de pelicula muy sutil, aspecto autentico sin retoque; nada estilizado.\nLIGHTING: Luz natural clara de mediodia; colores fieles; sin golden wash, sin teal-and-orange, sin HDR.\nCONTINUITY: Colores reales; sin dorado uniforme; Paisaje puro sin personas; Coherencia editorial con el set D4\nLOCALE: es / market GLOBAL; adaptation mode native. Paisaje y arquitectura publica; sin personas; sin marcas.\nPLACEMENT: instagram feed, 1080x1350; preserve safe zones from platform-spec:instagram-feed:2026-07-17.\nDISTINCTIVE ELEMENTS: Faro esbelto en composicion vertical grafica; Palmeras y manglares del rio; Dunas y Atlantico al fondo\nREFERENCE INSTRUCTIONS: No provider-visible references.\nDETERMINISTIC POST-COMPOSITION: logo, overlay_text, cta. Leave intentional negative space for those layers.",
  "negative_constraints": [
    "Agua turquesa tropical o caribena; el agua es de lluvia en color real oliva-verdosa/azul-gris",
    "Bano dorado uniforme, golden hour wash, teal-and-orange, HDR",
    "Rostros identificables; multitudes; retratos de residentes o pescadores",
    "Cliches: otro planeta, Marte, paraiso magico, desierto que se inunda por magia",
    "Texto, logos o marcas dentro del pixel generado",
    "Cualquier persona o figura",
    "Arquitectura deformada o torre distorsionada",
    "Do not render final logos, legal lines, prices, captions, CTA text or exact overlay copy inside the generated pixels.",
    "Do not imitate a living artist, competitor campaign or third-party brand style.",
    "Do not introduce products, people, claims or trademarks that are absent from the approved design and references."
  ],
  "parameters": {
    "placement_id": "instagram-carousel-p4",
    "width": 1080,
    "height": 1350,
    "quality_ref": "config:creative.image.quality",
    "output_format": "png",
    "max_attempts": 3,
    "max_assets": 1
  },
  "references": [],
  "request_hash": "sha256:29d8a7f229ea6d4723d52fe236d4612bd0704543a48a0238f0ca3d91ffe08d6d"
}
